{
  "$id": "https://posthog-impact.local/schemas/components.schema.json",
  "$schema": "https://json-schema.org/draft/2020-12/schema",
  "additionalProperties": false,
  "properties": {
    "component": {
      "arrow_type": "string",
      "type": [
        "string",
        "null"
      ]
    },
    "component_map_version": {
      "arrow_type": "string",
      "type": [
        "string",
        "null"
      ]
    },
    "label": {
      "arrow_type": "string",
      "type": [
        "string",
        "null"
      ]
    },
    "manifest_path": {
      "arrow_type": "string",
      "type": [
        "string",
        "null"
      ]
    },
    "manifest_sha256": {
      "arrow_type": "string",
      "type": [
        "string",
        "null"
      ]
    },
    "path_glob": {
      "arrow_type": "string",
      "type": [
        "string",
        "null"
      ]
    },
    "platform": {
      "arrow_type": "string",
      "type": [
        "string",
        "null"
      ]
    },
    "snapshot_commit": {
      "arrow_type": "string",
      "type": [
        "string",
        "null"
      ]
    },
    "source_rule": {
      "arrow_type": "string",
      "type": [
        "string",
        "null"
      ]
    }
  },
  "title": "components",
  "type": "object",
  "x-pipeline-version": "1.0.0",
  "x-schema-version": "1.0.0"
}
