[
  {
    "component": "frontend:app",
    "component_map_version": "1.0.0",
    "label": "app",
    "manifest_path": null,
    "manifest_sha256": null,
    "path_glob": "frontend/**",
    "platform": "platform",
    "snapshot_commit": "d4295d5794f95a0ae726edd0e27450115f3fc0a3",
    "source_rule": "convention"
  },
  {
    "component": "frontend:layout",
    "component_map_version": "1.0.0",
    "label": "layout",
    "manifest_path": null,
    "manifest_sha256": null,
    "path_glob": "frontend/src/layout/**",
    "platform": "platform",
    "snapshot_commit": "d4295d5794f95a0ae726edd0e27450115f3fc0a3",
    "source_rule": "convention"
  },
  {
    "component": "frontend:queries",
    "component_map_version": "1.0.0",
    "label": "queries",
    "manifest_path": null,
    "manifest_sha256": null,
    "path_glob": "frontend/src/queries/**",
    "platform": "platform",
    "snapshot_commit": "d4295d5794f95a0ae726edd0e27450115f3fc0a3",
    "source_rule": "convention"
  },
  {
    "component": "frontend:scenes",
    "component_map_version": "1.0.0",
    "label": "scenes",
    "manifest_path": null,
    "manifest_sha256": null,
    "path_glob": "frontend/src/scenes/**",
    "platform": "platform",
    "snapshot_commit": "d4295d5794f95a0ae726edd0e27450115f3fc0a3",
    "source_rule": "convention"
  },
  {
    "component": "frontend:shared-lib",
    "component_map_version": "1.0.0",
    "label": "shared lib",
    "manifest_path": null,
    "manifest_sha256": null,
    "path_glob": "frontend/src/lib/**",
    "platform": "platform",
    "snapshot_commit": "d4295d5794f95a0ae726edd0e27450115f3fc0a3",
    "source_rule": "convention"
  },
  {
    "component": "frontend:toolbar",
    "component_map_version": "1.0.0",
    "label": "toolbar",
    "manifest_path": null,
    "manifest_sha256": null,
    "path_glob": "frontend/src/toolbar/**",
    "platform": "platform",
    "snapshot_commit": "d4295d5794f95a0ae726edd0e27450115f3fc0a3",
    "source_rule": "convention"
  },
  {
    "component": "infra:agent-config",
    "component_map_version": "1.0.0",
    "label": "agent config",
    "manifest_path": null,
    "manifest_sha256": null,
    "path_glob": ".agents/**",
    "platform": "infrastructure",
    "snapshot_commit": "d4295d5794f95a0ae726edd0e27450115f3fc0a3",
    "source_rule": "convention"
  },
  {
    "component": "infra:agent-os",
    "component_map_version": "1.0.0",
    "label": "agent os",
    "manifest_path": null,
    "manifest_sha256": null,
    "path_glob": "agent-os/**",
    "platform": "infrastructure",
    "snapshot_commit": "d4295d5794f95a0ae726edd0e27450115f3fc0a3",
    "source_rule": "convention"
  },
  {
    "component": "infra:ci",
    "component_map_version": "1.0.0",
    "label": "ci",
    "manifest_path": null,
    "manifest_sha256": null,
    "path_glob": ".github/workflows/**",
    "platform": "infrastructure",
    "snapshot_commit": "d4295d5794f95a0ae726edd0e27450115f3fc0a3",
    "source_rule": "convention"
  },
  {
    "component": "infra:devenv",
    "component_map_version": "1.0.0",
    "label": "devenv",
    "manifest_path": null,
    "manifest_sha256": null,
    "path_glob": "devenv/**",
    "platform": "infrastructure",
    "snapshot_commit": "d4295d5794f95a0ae726edd0e27450115f3fc0a3",
    "source_rule": "convention"
  },
  {
    "component": "infra:docker",
    "component_map_version": "1.0.0",
    "label": "docker",
    "manifest_path": null,
    "manifest_sha256": null,
    "path_glob": "docker/**",
    "platform": "infrastructure",
    "snapshot_commit": "d4295d5794f95a0ae726edd0e27450115f3fc0a3",
    "source_rule": "convention"
  },
  {
    "component": "infra:docs",
    "component_map_version": "1.0.0",
    "label": "docs",
    "manifest_path": null,
    "manifest_sha256": null,
    "path_glob": "docs/**",
    "platform": "infrastructure",
    "snapshot_commit": "d4295d5794f95a0ae726edd0e27450115f3fc0a3",
    "source_rule": "convention"
  },
  {
    "component": "infra:e2e",
    "component_map_version": "1.0.0",
    "label": "e2e",
    "manifest_path": null,
    "manifest_sha256": null,
    "path_glob": "playwright/**",
    "platform": "infrastructure",
    "snapshot_commit": "d4295d5794f95a0ae726edd0e27450115f3fc0a3",
    "source_rule": "convention"
  },
  {
    "component": "infra:patches",
    "component_map_version": "1.0.0",
    "label": "patches",
    "manifest_path": null,
    "manifest_sha256": null,
    "path_glob": "patches/**",
    "platform": "infrastructure",
    "snapshot_commit": "d4295d5794f95a0ae726edd0e27450115f3fc0a3",
    "source_rule": "convention"
  },
  {
    "component": "infra:repo-config",
    "component_map_version": "1.0.0",
    "label": "repo config",
    "manifest_path": null,
    "manifest_sha256": null,
    "path_glob": ".github/**",
    "platform": "infrastructure",
    "snapshot_commit": "d4295d5794f95a0ae726edd0e27450115f3fc0a3",
    "source_rule": "convention"
  },
  {
    "component": "infra:repo-root",
    "component_map_version": "1.0.0",
    "label": "repo root",
    "manifest_path": null,
    "manifest_sha256": null,
    "path_glob": "*",
    "platform": "infrastructure",
    "snapshot_commit": "d4295d5794f95a0ae726edd0e27450115f3fc0a3",
    "source_rule": "convention"
  },
  {
    "component": "infra:scripts",
    "component_map_version": "1.0.0",
    "label": "scripts",
    "manifest_path": null,
    "manifest_sha256": null,
    "path_glob": "bin/**",
    "platform": "infrastructure",
    "snapshot_commit": "d4295d5794f95a0ae726edd0e27450115f3fc0a3",
    "source_rule": "convention"
  },
  {
    "component": "infra:share",
    "component_map_version": "1.0.0",
    "label": "share",
    "manifest_path": null,
    "manifest_sha256": null,
    "path_glob": "share/**",
    "platform": "infrastructure",
    "snapshot_commit": "d4295d5794f95a0ae726edd0e27450115f3fc0a3",
    "source_rule": "convention"
  },
  {
    "component": "infra:terraform",
    "component_map_version": "1.0.0",
    "label": "terraform",
    "manifest_path": null,
    "manifest_sha256": null,
    "path_glob": "terraform/**",
    "platform": "infrastructure",
    "snapshot_commit": "d4295d5794f95a0ae726edd0e27450115f3fc0a3",
    "source_rule": "convention"
  },
  {
    "component": "ingestion:node",
    "component_map_version": "1.0.0",
    "label": "node",
    "manifest_path": null,
    "manifest_sha256": null,
    "path_glob": "nodejs/**",
    "platform": "platform",
    "snapshot_commit": "d4295d5794f95a0ae726edd0e27450115f3fc0a3",
    "source_rule": "convention"
  },
  {
    "component": "ingestion:plugin-server",
    "component_map_version": "1.0.0",
    "label": "plugin server",
    "manifest_path": null,
    "manifest_sha256": null,
    "path_glob": "plugin-server/**",
    "platform": "platform",
    "snapshot_commit": "d4295d5794f95a0ae726edd0e27450115f3fc0a3",
    "source_rule": "convention"
  },
  {
    "component": "platform:api",
    "component_map_version": "1.0.0",
    "label": "api",
    "manifest_path": null,
    "manifest_sha256": null,
    "path_glob": "posthog/api/**",
    "platform": "platform",
    "snapshot_commit": "d4295d5794f95a0ae726edd0e27450115f3fc0a3",
    "source_rule": "convention"
  },
  {
    "component": "platform:cli",
    "component_map_version": "1.0.0",
    "label": "cli",
    "manifest_path": null,
    "manifest_sha256": null,
    "path_glob": "cli/**",
    "platform": "platform",
    "snapshot_commit": "d4295d5794f95a0ae726edd0e27450115f3fc0a3",
    "source_rule": "convention"
  },
  {
    "component": "platform:clickhouse",
    "component_map_version": "1.0.0",
    "label": "clickhouse",
    "manifest_path": null,
    "manifest_sha256": null,
    "path_glob": "posthog/clickhouse/**",
    "platform": "platform",
    "snapshot_commit": "d4295d5794f95a0ae726edd0e27450115f3fc0a3",
    "source_rule": "convention"
  },
  {
    "component": "platform:dagster",
    "component_map_version": "1.0.0",
    "label": "dagster",
    "manifest_path": null,
    "manifest_sha256": null,
    "path_glob": "posthog/dags/**",
    "platform": "platform",
    "snapshot_commit": "d4295d5794f95a0ae726edd0e27450115f3fc0a3",
    "source_rule": "convention"
  }
]
